{
 "schema_version": "2.0",
 "report_date": "2026-06-22",
 "report_kind": "market-scan",
 "regime": "CHOP",
 "regime_context": {
  "regime_label": "CHOP",
  "ret5": 0.0036,
  "ret10": 0.0093,
  "vol_state": "mildly-up / flat, balanced breadth (dry-run proxy: SPY 5d +0.4%, 10d +0.9%, breadth 49% green; GEX/DEX not queried)",
  "breadth_pct_green": 0.49,
  "directional_tradable": true,
  "s1_standdown": false,
  "event_risk": []
 },
 "vol_book": [],
 "watchlist_write_back": [
  "NVDA",
  "UMC",
  "CRDO",
  "MSFT",
  "PLTR"
 ],
 "report_path": "analyses/scan/2026-06-22/report.md",
 "calls": [
  {
   "ticker": "NVDA",
   "lane": "OI_FADE",
   "direction": "short",
   "horizon_validated": 10,
   "validated_excess": 0.0088,
   "excess_hit_minus_base": 0.205,
   "excess_n": 640,
   "regime_fit": 0.7,
   "tier": "MEDIUM",
   "final_size": "starter",
   "gate_verdicts": {
    "regime_crash": "no_op",
    "liquidity": "pass",
    "cluster": "megacap-tech OI-fade cluster \u2192 sized ONCE; NVDA only clean entry (-1.0%); MSFT/AMZN/NFLX/PLTR extended, SMCI +15.7% popped",
    "fundamentals": "CAUTION: strong underlying \u2192 tactical OI-fade only",
    "event_risk": "ER 2026-08-26 \u2014 outside h10",
    "tail_cap": "starter; regime_fit DISCOUNTED 0.7 \u2014 ret10 +0.93% (mildly-up tape doesn't support shorts)"
   },
   "fundamentals_verdict": "CAUTION",
   "invalidation": "5d call-OI build reverses / breaks out; broad risk-on continuation",
   "realized_excess_pct": null,
   "cluster_id": "oi_megacap_tech",
   "tail_cap_applied": "starter"
  },
  {
   "ticker": "SPCH",
   "lane": "MOM_SHORT",
   "direction": "short",
   "horizon_validated": 10,
   "validated_excess": 0.0081,
   "excess_hit_minus_base": 0.095,
   "excess_n": 273,
   "regime_fit": 0.0,
   "tier": "DROP",
   "final_size": "skip",
   "gate_verdicts": {
    "regime_crash": "no_op",
    "liquidity": "broken/leveraged structured ETFs (SPCH/SPCU/SPCF/SPAL/LOFF all ~-33%; PTIR/PLTU lev) \u2014 issue-type floor \u2192 dropped",
    "cluster": "n/a",
    "fundamentals": "NA",
    "event_risk": "no_op",
    "tail_cap": "n/a"
   },
   "fundamentals_verdict": "NA",
   "invalidation": "n/a \u2014 not a tradable momentum short",
   "realized_excess_pct": null
  },
  {
   "ticker": "WEN",
   "lane": "MOM_SHORT",
   "direction": "short",
   "horizon_validated": 10,
   "validated_excess": 0.0081,
   "excess_hit_minus_base": 0.095,
   "excess_n": 273,
   "regime_fit": 0.5,
   "tier": "WATCH",
   "final_size": "watch",
   "gate_verdicts": {
    "regime_crash": "no_op",
    "liquidity": "pass",
    "cluster": "consumer/IT-services single-name cohort (WEN/WHR/Z/LULU/BAH/CTSH/GWRE/SAP) \u2014 mostly -4..-9% on day = extended",
    "fundamentals": "CAUTION",
    "event_risk": "ER 2026-08-14",
    "tail_cap": "WATCH: -9.3% extended + mildly-up regime"
   },
   "fundamentals_verdict": "NA",
   "invalidation": "reclaims 52w-low anchor / consumer rebound",
   "realized_excess_pct": null
  },
  {
   "ticker": "MSFT",
   "lane": "OI_FADE",
   "direction": "short",
   "horizon_validated": 10,
   "validated_excess": 0.0088,
   "excess_hit_minus_base": 0.205,
   "excess_n": 640,
   "regime_fit": 0.7,
   "tier": "WATCH",
   "final_size": "watch",
   "gate_verdicts": {
    "regime_crash": "no_op",
    "liquidity": "pass",
    "cluster": "clustered w/ NVDA \u2192 exposure once via NVDA; -3.2% more extended",
    "fundamentals": "CAUTION",
    "event_risk": "ER 2026-07-29 \u2014 outside h10",
    "tail_cap": "n/a"
   },
   "fundamentals_verdict": "NA",
   "invalidation": "part of megacap-tech OI-fade basket",
   "realized_excess_pct": null,
   "cluster_id": "oi_megacap_tech"
  },
  {
   "ticker": "PLTR",
   "lane": "OI_FADE",
   "direction": "short",
   "horizon_validated": 10,
   "validated_excess": 0.0088,
   "excess_hit_minus_base": 0.205,
   "excess_n": 640,
   "regime_fit": 0.7,
   "tier": "WATCH",
   "final_size": "watch",
   "gate_verdicts": {
    "regime_crash": "no_op",
    "liquidity": "pass",
    "cluster": "dual-lane (MOM_SHORT+OI_FADE, both short), -7.0% extended = noted not summed, too extended to initiate",
    "fundamentals": "CAUTION",
    "event_risk": "ER 2026-08-03 \u2014 outside h10",
    "tail_cap": "WATCH"
   },
   "fundamentals_verdict": "NA",
   "invalidation": "OI build reverses / breaks out",
   "realized_excess_pct": null,
   "cluster_id": "oi_megacap_tech"
  },
  {
   "ticker": "BABA",
   "lane": "MOM_SHORT",
   "direction": "short",
   "horizon_validated": 10,
   "validated_excess": 0.0081,
   "excess_hit_minus_base": 0.095,
   "excess_n": 273,
   "regime_fit": 0.6,
   "tier": "WATCH",
   "final_size": "watch",
   "gate_verdicts": {
    "regime_crash": "no_op",
    "liquidity": "pass",
    "cluster": "China member (also OI_FADE short = noted, not summed)",
    "fundamentals": "NA(ADR)",
    "event_risk": "ER 2026-09-04",
    "tail_cap": "n/a"
   },
   "fundamentals_verdict": "NA",
   "invalidation": "part of China-complex short basket",
   "realized_excess_pct": null,
   "cluster_id": "mom_china"
  },
  {
   "ticker": "UMC",
   "lane": "MOM_LONG",
   "direction": "long",
   "horizon_validated": 10,
   "validated_excess": 0.0235,
   "excess_hit_minus_base": -0.093,
   "excess_n": 344,
   "regime_fit": 0.7,
   "tier": "WATCH",
   "final_size": "watch",
   "gate_verdicts": {
    "regime_crash": "no_op",
    "liquidity": "pass",
    "cluster": "SEMIS breakout basket (UMC+14.2/CRDO+11.3/ASX+7.5; SOXL 3x-ETF dropped) \u2014 cleanest 52w-high thematic on the tape",
    "fundamentals": "NA",
    "event_risk": "cluster ER late-July",
    "tail_cap": "basket (tail-driven; long never sized per-name)"
   },
   "fundamentals_verdict": "NA",
   "invalidation": "semis basket loses 52w-high breakouts / risk-off reversal",
   "realized_excess_pct": null,
   "cluster_id": "mom_long_semis",
   "tail_cap_applied": "basket"
  },
  {
   "ticker": "SYRE",
   "lane": "MOM_LONG",
   "direction": "long",
   "horizon_validated": 10,
   "validated_excess": 0.0235,
   "excess_hit_minus_base": -0.093,
   "excess_n": 344,
   "regime_fit": 0.4,
   "tier": "WATCH",
   "final_size": "watch",
   "gate_verdicts": {
    "regime_crash": "no_op",
    "liquidity": "pass",
    "cluster": "biotech basket \u2014 but DFTX +49.8/APGE +46.7/SYRE +13.6 are NEWS-pops (M&A/data), NOT momentum signal; LABU 3x dropped",
    "fundamentals": "NA",
    "event_risk": "news-driven",
    "tail_cap": "basket; news-pops excluded from clean momentum"
   },
   "fundamentals_verdict": "NA",
   "invalidation": "basket loses 52w-high breakouts / sharp risk-off",
   "realized_excess_pct": null,
   "cluster_id": "mom_long_biotech",
   "tail_cap_applied": "basket"
  },
  {
   "ticker": "SO",
   "lane": "S2_dp_revert",
   "direction": "long",
   "horizon_validated": 5,
   "validated_excess": 0.0047,
   "excess_hit_minus_base": 0.015,
   "excess_n": 336,
   "regime_fit": 0.7,
   "tier": "WATCH",
   "final_size": "watch",
   "gate_verdicts": {
    "regime_crash": "no_op",
    "liquidity": "pass",
    "cluster": "S2 defensive cohort (SO/NRG/EXC utilities + KVUE/MDLZ/BALL staples) \u2014 mildly-up tape, low-conviction reversion",
    "fundamentals": "NA",
    "event_risk": "ER 2026-07-30",
    "tail_cap": "cut on news/earnings"
   },
   "fundamentals_verdict": "NA",
   "invalidation": "news/earnings emerges; concentration not repeated next session",
   "realized_excess_pct": null
  },
  {
   "ticker": "WMG",
   "lane": "S4_pcr_fade",
   "direction": "long",
   "horizon_validated": 5,
   "validated_excess": 0.0071,
   "excess_hit_minus_base": -0.015,
   "excess_n": 331,
   "regime_fit": 0.5,
   "tier": "ADVISORY",
   "final_size": "watch",
   "gate_verdicts": {
    "regime_crash": "no_op",
    "liquidity": "pass",
    "cluster": "S4 advisory cohort \u2014 never sized",
    "fundamentals": "NA",
    "event_risk": "no_op",
    "tail_cap": "advisory"
   },
   "fundamentals_verdict": "NA",
   "invalidation": "put-heavy turns out informed (gap down on news)",
   "realized_excess_pct": null
  }
 ]
}