{
 "schema_version": "2.0",
 "report_date": "2026-06-26",
 "report_kind": "market-scan",
 "regime": "CHOP",
 "regime_context": {
  "regime_label": "CHOP",
  "ret5": -0.0238,
  "ret10": -0.0119,
  "vol_state": "mild risk-off, no vol spike (dry-run proxy: SPY 5d -2.4%, breadth 60% green; GEX/DEX not queried)",
  "breadth_pct_green": 0.6,
  "directional_tradable": true,
  "s1_standdown": false,
  "event_risk": []
 },
 "vol_book": [],
 "watchlist_write_back": [
  "NVDA",
  "MARA",
  "FXI",
  "CME",
  "MSTR",
  "MSFT",
  "BABA"
 ],
 "report_path": "analyses/scan/2026-06-26/report.md",
 "calls": [
  {
   "ticker": "NVDA",
   "lane": "OI_FADE",
   "direction": "short",
   "horizon_validated": 10,
   "validated_excess": 0.0088,
   "excess_hit_minus_base": 0.205,
   "excess_n": 640,
   "regime_fit": 1.0,
   "tier": "MEDIUM",
   "final_size": "half",
   "gate_verdicts": {
    "regime_crash": "no_op",
    "liquidity": "pass",
    "cluster": "megacap-tech cluster \u2192 sized ONCE (representative)",
    "fundamentals": "CAUTION: fundamentally strong \u2192 tactical OI-fade only, do not oversize",
    "event_risk": "next ER 2026-08-26 \u2014 outside h10",
    "tail_cap": "half (mega-cap squeeze tail)"
   },
   "fundamentals_verdict": "CAUTION",
   "invalidation": "5d call-OI build reverses / breaks out on real catalyst",
   "realized_excess_pct": null,
   "cluster_id": "oi_megacap_tech",
   "tail_cap_applied": "half"
  },
  {
   "ticker": "MARA",
   "lane": "OI_FADE",
   "direction": "short",
   "horizon_validated": 10,
   "validated_excess": 0.0088,
   "excess_hit_minus_base": 0.205,
   "excess_n": 640,
   "regime_fit": 1.0,
   "tier": "MEDIUM",
   "final_size": "starter",
   "gate_verdicts": {
    "regime_crash": "no_op",
    "liquidity": "pass",
    "cluster": "crypto/meme cluster (MARA/GME/BMNR) \u2192 sized ONCE",
    "fundamentals": "CAUTION: high-beta crypto proxy",
    "event_risk": "next ER 2026-08-04 \u2014 outside h10",
    "tail_cap": "starter (crypto tail)"
   },
   "fundamentals_verdict": "CAUTION",
   "invalidation": "OI build reverses / BTC rips",
   "realized_excess_pct": null,
   "cluster_id": "oi_crypto_meme",
   "tail_cap_applied": "starter"
  },
  {
   "ticker": "FXI",
   "lane": "MOM_SHORT",
   "direction": "short",
   "horizon_validated": 10,
   "validated_excess": 0.0081,
   "excess_hit_minus_base": 0.095,
   "excess_n": 273,
   "regime_fit": 1.0,
   "tier": "MEDIUM",
   "final_size": "starter",
   "gate_verdicts": {
    "regime_crash": "no_op",
    "liquidity": "pass",
    "cluster": "China complex (FXI/BABA/BEKE/XPEV/MCHI) \u2192 sized ONCE",
    "fundamentals": "NA (ETF)",
    "event_risk": "no_op",
    "tail_cap": "starter (policy-headline tail)"
   },
   "fundamentals_verdict": "NA",
   "invalidation": "reclaims 52w-low anchor 31.49 / China stimulus V-rebound",
   "realized_excess_pct": null,
   "cluster_id": "mom_china",
   "tail_cap_applied": "starter"
  },
  {
   "ticker": "CME",
   "lane": "MOM_SHORT",
   "direction": "short",
   "horizon_validated": 10,
   "validated_excess": 0.0081,
   "excess_hit_minus_base": 0.095,
   "excess_n": 273,
   "regime_fit": 1.0,
   "tier": "MEDIUM",
   "final_size": "starter",
   "gate_verdicts": {
    "regime_crash": "no_op",
    "liquidity": "pass",
    "cluster": "exchanges (CME/ICE) \u2192 sized ONCE",
    "fundamentals": "CAUTION: durable franchise, fade is tactical",
    "event_risk": "next ER 2026-07-22 \u2014 outside h10",
    "tail_cap": "starter"
   },
   "fundamentals_verdict": "CAUTION",
   "invalidation": "reclaims 52w-low anchor 224.4 / market V-rebound",
   "realized_excess_pct": null,
   "cluster_id": "mom_exchanges",
   "tail_cap_applied": "starter"
  },
  {
   "ticker": "MSTR",
   "lane": "MOM_SHORT",
   "direction": "short",
   "horizon_validated": 10,
   "validated_excess": 0.0081,
   "excess_hit_minus_base": 0.095,
   "excess_n": 273,
   "regime_fit": 1.0,
   "tier": "MEDIUM",
   "final_size": "starter",
   "gate_verdicts": {
    "regime_crash": "no_op",
    "liquidity": "pass",
    "cluster": "single (note: crypto-beta overlaps MARA theme)",
    "fundamentals": "CAUTION: bitcoin proxy, reflexive",
    "event_risk": "next ER 2026-07-30 \u2014 outside h10",
    "tail_cap": "starter (crypto tail)"
   },
   "fundamentals_verdict": "CAUTION",
   "invalidation": "reclaims 52w-low anchor 85.0 / BTC V-rebound",
   "realized_excess_pct": null,
   "tail_cap_applied": "starter"
  },
  {
   "ticker": "AAPL",
   "lane": "OI_FADE",
   "direction": "short",
   "horizon_validated": 10,
   "validated_excess": 0.0088,
   "excess_hit_minus_base": 0.205,
   "excess_n": 640,
   "regime_fit": 0.0,
   "tier": "DROP",
   "final_size": "skip",
   "gate_verdicts": {
    "regime_crash": "no_op",
    "liquidity": "pass",
    "cluster": "CONFLICT: AAPL is OI_FADE-short AND S2_dp_revert-long \u2192 dropped (lanes do not net)",
    "fundamentals": "NA",
    "event_risk": "no_op",
    "tail_cap": "n/a"
   },
   "fundamentals_verdict": "NA",
   "invalidation": "n/a \u2014 dropped on lane conflict",
   "realized_excess_pct": null
  },
  {
   "ticker": "AMZN",
   "lane": "OI_FADE",
   "direction": "short",
   "horizon_validated": 10,
   "validated_excess": 0.0088,
   "excess_hit_minus_base": 0.205,
   "excess_n": 640,
   "regime_fit": 0.0,
   "tier": "DROP",
   "final_size": "skip",
   "gate_verdicts": {
    "regime_crash": "no_op",
    "liquidity": "pass",
    "cluster": "CONFLICT: AMZN is OI_FADE-short AND S2_dp_revert-long \u2192 dropped (lanes do not net)",
    "fundamentals": "NA",
    "event_risk": "no_op",
    "tail_cap": "n/a"
   },
   "fundamentals_verdict": "NA",
   "invalidation": "n/a \u2014 dropped on lane conflict",
   "realized_excess_pct": null
  },
  {
   "ticker": "USFR",
   "lane": "MOM_SHORT",
   "direction": "short",
   "horizon_validated": 10,
   "validated_excess": 0.0081,
   "excess_hit_minus_base": 0.095,
   "excess_n": 273,
   "regime_fit": 0.0,
   "tier": "DROP",
   "final_size": "skip",
   "gate_verdicts": {
    "regime_crash": "no_op",
    "liquidity": "cash-equivalent ETF (USFR/ICSH/SHV/STIP/JPST/SGOV) \u2014 issue_type floor \u2192 dropped",
    "cluster": "n/a",
    "fundamentals": "NA",
    "event_risk": "no_op",
    "tail_cap": "n/a"
   },
   "fundamentals_verdict": "NA",
   "invalidation": "n/a \u2014 not a tradable momentum short",
   "realized_excess_pct": null
  },
  {
   "ticker": "MSFT",
   "lane": "OI_FADE",
   "direction": "short",
   "horizon_validated": 10,
   "validated_excess": 0.0088,
   "excess_hit_minus_base": 0.205,
   "excess_n": 640,
   "regime_fit": 1.0,
   "tier": "WATCH",
   "final_size": "watch",
   "gate_verdicts": {
    "regime_crash": "no_op",
    "liquidity": "pass",
    "cluster": "clustered w/ NVDA \u2192 exposure taken once via NVDA",
    "fundamentals": "CAUTION",
    "event_risk": "next ER 2026-07-29 \u2014 outside h10",
    "tail_cap": "n/a"
   },
   "fundamentals_verdict": "NA",
   "invalidation": "part of megacap-tech OI-fade basket",
   "realized_excess_pct": null,
   "cluster_id": "oi_megacap_tech"
  },
  {
   "ticker": "BABA",
   "lane": "MOM_SHORT",
   "direction": "short",
   "horizon_validated": 10,
   "validated_excess": 0.0081,
   "excess_hit_minus_base": 0.095,
   "excess_n": 273,
   "regime_fit": 1.0,
   "tier": "WATCH",
   "final_size": "watch",
   "gate_verdicts": {
    "regime_crash": "no_op",
    "liquidity": "pass",
    "cluster": "clustered w/ FXI \u2192 exposure taken once via FXI",
    "fundamentals": "NA(ADR)",
    "event_risk": "next ER 2026-09-04",
    "tail_cap": "n/a"
   },
   "fundamentals_verdict": "NA",
   "invalidation": "part of China-complex short basket",
   "realized_excess_pct": null,
   "cluster_id": "mom_china"
  },
  {
   "ticker": "ABBV",
   "lane": "MOM_LONG",
   "direction": "long",
   "horizon_validated": 10,
   "validated_excess": 0.0235,
   "excess_hit_minus_base": -0.093,
   "excess_n": 344,
   "regime_fit": 0.5,
   "tier": "WATCH",
   "final_size": "watch",
   "gate_verdicts": {
    "regime_crash": "no_op",
    "liquidity": "pass",
    "cluster": "healthcare/biotech basket (ABBV/GH/BIIB/MIRM/KRYS/ALKS/ABCL)",
    "fundamentals": "NA",
    "event_risk": "next ER 2026-07-30",
    "tail_cap": "basket (tail-driven; long leg never sized per-name)"
   },
   "fundamentals_verdict": "NA",
   "invalidation": "basket loses 52w-high breakouts / sharp risk-off",
   "realized_excess_pct": null,
   "cluster_id": "mom_long_biotech_basket",
   "tail_cap_applied": "basket"
  },
  {
   "ticker": "GOOG",
   "lane": "S2_dp_revert",
   "direction": "long",
   "horizon_validated": 5,
   "validated_excess": 0.0047,
   "excess_hit_minus_base": 0.015,
   "excess_n": 336,
   "regime_fit": 0.6,
   "tier": "WATCH",
   "final_size": "watch",
   "gate_verdicts": {
    "regime_crash": "no_op",
    "liquidity": "pass",
    "cluster": "S2 cohort (GOOG/KO/SNOW/UBER/CIEN/\u2026), news-gated",
    "fundamentals": "NA",
    "event_risk": "next ER 2026-07-22",
    "tail_cap": "cut on news/earnings"
   },
   "fundamentals_verdict": "NA",
   "invalidation": "news/earnings emerges; concentration not repeated next session",
   "realized_excess_pct": null
  },
  {
   "ticker": "WMS",
   "lane": "S4_pcr_fade",
   "direction": "long",
   "horizon_validated": 5,
   "validated_excess": 0.0071,
   "excess_hit_minus_base": -0.015,
   "excess_n": 331,
   "regime_fit": 0.5,
   "tier": "ADVISORY",
   "final_size": "watch",
   "gate_verdicts": {
    "regime_crash": "no_op",
    "liquidity": "pass",
    "cluster": "S4 advisory cohort \u2014 never sized",
    "fundamentals": "NA",
    "event_risk": "no_op",
    "tail_cap": "advisory"
   },
   "fundamentals_verdict": "NA",
   "invalidation": "put-heavy turns out informed (gap down on news)",
   "realized_excess_pct": null
  }
 ]
}